Title,Date,Rating,Content
Fantabulous Indian cinema - Slow to digest but overall great appeal,24 December 2009,9.0,"Well, to start with, lemme clarify, I have a knack of bringing down bollywood cinema being a puritanical movie critic. And the only reason I still hold on to Indian Cinema is Aamir khan. His movies have been the cornerstone of generational behavior through the decades. Indians have experiences the best of reelistic emotions, vigor, love, comedy through the works of Aamir. He defines a supreme talent with an eye for every detail that could connect with the audience in the lightest and most deepest of senses. You will never know what hits you when you watch some of his best works.Moving forward, I went to see 3 idiots with the same expectations from an Aamir movie. Starting with the storyline, it was pretty well presented and starting was glitchy which was readily made up by Aamir's presence, which obviously was staged as such but does make a nice impact. His two sideburns namely Sharman and Maddy did a superb job in their own respective way and special mention to Maddy for his subtle way of bringing the best out of a sidekick role. Another special mention goes to a character names Chatur (dunno the real name) for adding superb comic zing to the movie. Gals were passé but were essential. Some of the scenes were long dragged and kinda unnecessary songs as such a repertoire of bollywood, nevertheless, weighing pros against cons which anyways outnumber the cons, I would like to assure the kind of essence movie brings out as a whole is meaningful and thematic in the most lighthearted and fun filled way.Some of the hilarious scenes were so funny that my friend mentioned it to be the best comic scene in Indians cinema. People might point it out as gross or amateurish but it does forms an essential part of college humor which still is gibberish and kindergarten grade compared to western comedies. Aamir does a fantastic job again maybe not that much as the role he portrays but as an overall feel he brings to any movie he forms a part of. Hirani does bring lot of experiences from his part ventures into this movie but they are well figured out and I must admit, he does belong to the best breed of directors in Indian cinema's current generation with the likes of Imtiaz Ali, Vishal Bhardwaj and Prakash jha, masters in their own genre.Overall movie does give you a fantastic feel as you walk out of the theater and is a perfect gift from Aamir to everyone for Christmas. A must watch for Indian cinema buffs and indeed figures as one of the best recent movies with no award winning stuff but just for the flow it controls the psyche of the audience and brings them through all simple emotions with laughter and grit.3.5/5"
"3 Idiots: Chetan Bhagat, Raju Hirani and Us",1 January 2010,9.0,"3 Idiots 6/10Rating it more than that is an insult to other good movies.Warning: If u've read the book which it claims to be inspired of, u'll be highly disappointed. The movie is so much diff. than book.Angst: Correct me if I'm wrong, but I could not find a single line giving credits to Chetan Bhagat for the idea at least.Question: Remember Taare Zamin Par? Now take Ishan Awasti from it, make him older enough to get into a college and make Amir Khan play the character, what do u get?? We get Taare Zamin Part-2 or 3 Idiots.This movie is a mix of Munnabhai MBBS and Taare Zamin Par (Painting vs. Photography; as if there is only one creative work in this world). Even the dialogs sound similar to Taare Zamin Par. I ask, what is the point in shouting same issue over and over, what is the point in proving same point everyday.Let me tell u, 3-Idiots has nothing new to deliver. This movie wanted to be in Munnabhai league but failed miserably. It lacks the fine tuning, light hearted situational comedy with subtle strong points. It lacks all Raju Hirani/VC effects.Yes, there are a few good comic scenes (the lecture is good but just drags and after a moment I was getting irritated by over-using of the words ""balatkar"" and ""stan"")And what should I talk about the screenplay, bakwas and weak, even most Imran Hasmi/Harman Baweja movies have good integrated script than this.Acting: Sharman Joshi is mentionable, Amir did overact, yes, I say it, just watch the scene when the dean drags him from his office to a classroom he acts like something funny is going on, scratches his head, a very loose body language and not at all matching to what a student might feel if he is dragged through corridor by the dean of a very renowned college of India. Amir just fails to portray a student.I can go on and on about its stupid loopholes, but lets stop here. Last but not the least, u have to bear some good but misplaced songs throughout the movie.Reading this far one can tell I hated this movie, then why u may watch it? 1>U will get some good laughs in a few good scenes 2>A good but repetitive theme 3>A feel good effect 4>Amir's only movie in this year (for Amir fans)"
A different Indian Movie but a little dragged on,7 January 2010,9.0,"I have a bunch of Indian and Pakistani friends and they were all going over the moon with this movie so I decided to watch it. There is one way to describe this movie and that is different.The story revolves around three engineering students who bond with each other. Rancho is a brilliant student who prefers to have fun and makes it his duty to help people in any way he can. Farhan is a student who loves photography and was forced to go to the top engineering school by his dad. Raju is a religious student from a poor family that tries to excel in the school. THroughout the movie, they have their little adventures and even a couple of surprises or two in the school they are studying in. While the movie is different from most Indian Movies, the movie is a little long and a little dragged on. While it is primarily a comedy movie and there are many jokes in the movie, most of them aren't that funny and there were some very babyish jokes (people pulling their pants down randomly and people talking to each other while on the toilets). Like most Hindi Movies, there were also some good songs, but one was a nonsensical song that sounded unusually similar to zipadee doo daa. Towards the end (last 45 minutes) the movie also became painfully predictable and did not match the explosive first hour that had me captivated. The message however was very well understood and very well put in the movie.Aamir Khan is an outstanding movie star and he shines in this movie and as I heard he also produced this movie, it greatly resembles his other movie, Taare Zameen Par, in which a kid that is dyslexic rises above the standard and traditional South Asian view that a child must learn a certain way. It parallels the moral of this story in which South Asian communities must broaden their views and be more flexible instead of forcing their children to becomes either doctors or engineers and to not put pressure on their children by asking high demands in education.Overall, its a movie to watch because of its message."
Another Munnabhai...Nothing great.,9 January 2010,2.0,No...Its not Sholay or Lagaan or even Hum Aapke Hain Kaun or Gadar. No I am not comparing with them. After noticing lots of popularity I was also pulled into the hype. But was disappointed to see another movie like Munnabhai. Same College and Principal and hospital etc. Not fresh story at all. Lots of old jokes. Some sequences are absurd. 3 idiots can take a old patient to Hospital but cannot take a pregnant woman and applies their engineering knowledge to deliver a baby. They can gather the whole college but not a single girl to deliver a baby. Like I said...its a good bollywood masala movie but nothing great. I don't know why some people are surprised about Aaamir's acting as a college boy. His face is still boyish and suits these kind of roles. May I ask in which film he looked like a Man? Arshad Warsi could have done better job in this movie. Now the good things. There were some good dialogues and good acting from Sharman Joshi(Raju) and Omi Vaidya(Ramalingam). This movie is Chatur Ramalingam's. The producers are clever to market the movie like Ghazni and make their money. After few days we audiences will look back and think how they made fool of us. This movie is worth watching only in DVDs.
"Now that, is a movie! Enjoyable. Fun. Unique. Brilliant. Emotional.",6 November 2014,2.0,"May I add to that, potentially life-changing!I would rate this movie somewhere between 9 and 10 , I wasn't sure which grade to give it, but 10 seems more appropriate.This movie actually , has many flaws. And I know I often watch a movie then rate it with a 5/10 , then rumble about it's flaws.. But, sometimes there is just something that you ""love"" and in it the flaws are minimized and overlooked. So it is with this movie for me. I love love love how inspiring it is. And how it can bring the emotions out of you. Make you connect and feel with the characters! This is simply amazing! Not many movies can do that. There are 2 or 3 scenes that I adore, and then there are others, flawed and all.. but still this movie is just special. A must watch. It starts a bit slow.. but you have to be patient. First half is good, second half is awesome! The cast in this movie is perfect! Amir, his friends, the teacher , the girl. Just perfect. And really the girl was an important role to cast and she is such a good choice! Looks wise at first you would think hmmm maybe not so much; but that girl has a spark that you will not find. I saw her in one other movie and so I knew what she could do, and surely as movie rolls along , she adds her sparkly personality and lifts the movie a notch higher. Aamir Khan has become my favorite Indian actor, and is perfect in this, and the professor is also such a good choice! Just wow! Why do I go on and on about the cast, because this cast made the movie what it is. It's not about how well you act, it's how well a role you are put into based on who you are. A super good movie! Different from Hollywood, very refreshing!Real rating: 9.35"
3 Idiots is one of the best!,30 January 2015,9.0,"Im not a Hindi movie fan, in fact, this is my first time to watch Hindi movie. But this film is totally blowing my mind! Great story, good script writing, best performance of Aamir and also others actors / actress too. 2 Thumbs up for 3 Idiots! Its not simply just a comedy, but with something to think about for our own, and also bring along with touching moment! The positive message from this film will definitely hit the viewers. It shows how most of people are react at this present moment. Like, do we really do what we love and love what we are doing? If there's a fear, do we really take the risk and overcome it? If there's an opportunity, do we see it and hesitate about it? Well, sometimes the results is not that important, the process is the most concern and 3 idiots really taught us we should appreciate the relationship with parents, friends, the one we love & care! The cinematography is good, the songs & music are nice too! Rajkumar Hirani is brilliant director and script writer! Salute. Rajkumar Hirani is brilliant director and script writer! Salute."
"Amazing, inspiring and enchanting - one of best movies I have seen",1 October 2012,9.0,"Talking about unexpected When you see the title of the movie and know that it was best grossing Bollywood film that went around the world as a hit all around – well, you expect something watered down, something for everyone. Maybe in some way it is for everyone, but by far this is not bad.The message is simple – follow your heart, follow your dream and All Izz Good (a little chant of main character – Rancho – used in stressful situations). In India engineering is a prestigious occupation where many Indian parents see as future for their sons. Story is set in Nr. 1 Imperial Engineering University where our 3 main characters – Farhan, Raju and Rancho - meet. Most students are there to blindly cram book, get best scores in exams, get good job and buy big houses and big cars. But Rancho is different – he loves engineering and does not like the school system, he tries to change it. Sounds familiar? Well it is. But this is story is special. It is about real friendship, real emotions and a person who is able to inspire people, shake their mechanical lives, and wake them up. (Oh, and it has Bollywood song-and-dance cuts too, a lot of fun). It is indeed very pleasant to watch.As usual I would like to ponder upon one of notions of the movie. We all in our lives are faced with important choices and struggle to answer dilemmas they give us. Who should we listen to when we choose most important things in our lives – the Tradition, our Parents and Grandparents, our God or Gods, our Friends, our Hearts or our Rational Mind? It is tough. Sometimes it seems to me it was easier in the times when you knew from childhood who you will be – a son of blacksmith will be a blacksmith, a son of tanner most probably will be a tanner (well, for girls even more easy – marriage – but that's another topic). In Hindu philosophy, in Bhagavad Gita, a similar question is discussed. A great hero Arjuna I faced with a dilemma – he has to fight the battle, as he is kshatriya, warrior cast, however in this case he would have to kill people he knows and loves. He consults his chariot driver - god Krishna. Krishna tries to persuade him to fulfill his duty, his dharma as kshatriya. It is better to be mediocre warrior if this is your dharma, than to be best cook in the world and go against it. A philosophy difficult to pursue in life, especially in modern world. I personally think that since industrial revolution and alienation of worker and his/her work (to borrow the term from Marx), there is no way to see the profession, a job in the same way as it used to be (like I mentioned – son of tanner is tanner, but it was not a ""job"" in nowadays meaning). Our jobs are almost a consumer choice, just usually more permanent one. You choose your career along with it comes the attached lifestyle (a doctors lifestyle is different from engineers, and it is not only about the money, it has much to do with the constructed image of the profession). So in ambiguity of modern world, what does constitute as dharma? Rancho says it is voice of your heart.The movie has a happy ending. And if it is not pretentious enough for some critics – well, eh I think some things need to have a happy ending.P.S. I wonder how many engineering students in India dropped out after seeing this movie"
"It talks about faulty education system, unnecessary study pressure, wrong high expectation of parents, increasing materialism and ignorance of human values THE FUNNY WAY",1 January 2010,9.0,"There are many people who find nothing useful in real working life which have been taught and studied with great pressure during their student life. There are many instances where students have taken last step as suicide when they can't handle the study pressure. There are people who have inner abilities and skill sets of some other field than the field in which they are currently working or say there are people who trying hard to establish themselves in the field according to their chosen career path but can not make the headway. Actually these kind of people might have realised that they have taken wrong path and that is because of parent's expectation, social status or may be because of peer pressure. There are people who are repenting after making career in the field in which they are not enjoying and have mindset that they would have been done better in some other field. There are parents with the mindset that some educational field are good and some are bad. This is may be because of status in the society, job market and money reward in the field. But by this way they are ignoring inner abilities of their child and take the part in spoiling their career. This is like curing the disease the wrong way by giving wrong drug. This way they are killing their real pleasure. There are girls and guys who repenting after getting married to a person who is so materialistic who running behind only money and has no value for human feelings. Finally this kind of marriage wont last longer and results in the divorce. The film is giving good message to all of above people with humour. Songs are also good and well placed in the movie.Over all it is another very good movie of Aamir khan."
More than just a movie!!!!,25 December 2009,9.0,"When I heard that Raju Hirani, Abhijat Joshi and Aamir khan were working on a project together, I expected something good. I was wrong, because 'good' is a gross understatement of a project as brilliant as '3 idiots'. Yes, I call it a project because surely it goes beyond the realms of just being a movie. I say so because this movie stirs a dormant chord in our hearts, a chord that was always there but never found voice at the right time. If in TZP Aamir Khan made you cry and understand, in 3 idiots he will make you laugh tears but make sure you get the point. I sincerely hope that this movie can bring about a social change that is urgently required in our country today. Yes, the story is loosely based on Chetan Bhagats novel but it's far from being a theatrical adaptation. It has a story which will keep you fairly intrigued, humor that you will love and a message that surely has a lot of depth. Three friends stuck in an engineering college where none of them like the way things are run. Only one of them, has the courage to take things into his own hands- that's your protagonist Aamir Khan. You'll like him from his first appearance on screen and end up loving him. In his 40's he looks supremely convincing as a cool dude in college with a kind heart. Throughout the journey,he manages to capture your hearts with a perfect combination of humor and heart. If in TZP we saw Aamir Khan the director, here we are privileged to see Aamir- the actor take centre stage. He is phenomenal in his role and leaves adjectives inadequate for his performance. Kareena, the daughter of the head of the college is his love interest. She does justice to her given screen space and surely gets a few hearts beating fast during ""Zoobi Doobi"". Moving on from the love angle to the larger picture. Contrary to what you have heard or might hear, this movie not only challenges the Indian Education System, it decisively rubbishes it on every front. More than that, it challenges us to question our way of learning, of questioning, of thinking. Here, Madhvan and Sharman Joshi deserve an ovation for being splendid throughout the film. The friendship you saw in Rang De Basanti among a larger group was easily matched if not bettered by Maddy, Sharman and Aamir. Boman Irani picks off from where he left in Munnabhai playing the comic bad guy of sorts to perfection. The direction is flawless in terms of plot, setting and casting as each character justifies his/her role to the hilt. Also credit to the director for a climax which is sure to catch you by surprise! If I was coerced to point out flaws in this movie, I would say that Aamir's fake name concept, continuity of the film(which is more than 10 yrs) was a shade unrealistic. Also, the music is good, but as I said earlier, good is an understatement for this film. The epicenter of this earthquake called 3idiots ( I call it earthquake because that's what it will causeat the box office!!) is ""Always do what you love!!"" All I can say is that the entire cast and crew of this project definitely love what they do because their work gives us ample proof. If you'v watched it, go watch it again, if u haven't then I don't know what you are waiting for!! Go watch it, enjoy it, feel it but most important understand it. My Rating:- 9/10"
All time favourite Movie Masterpiece,14 April 2021,9.0,"What a Movie .. belive me this is the best movie in the world. The content level 🔥 Acting Amir Khan each & every one & Driector Raju Kumar Hirani just salute to you.. Emotional, Heart' touching story."
Strangely enjoyable in it's own unique way,6 January 2021,9.0,"Bollywood movies are an odd bunch, with their camp, colourful and cheesy style. 3 Idiots is arguably one of the better ones, despite being far too long and ridiculously corny. Fun storyline, decent performances and dripping in vivid colour."
Rajkumar hirani is christopher nolan of india,30 July 2020,10.0,"Aamir khan mr perfectionist & rajkumar hirani is god of screenplay writing this movie is pure masterpiece what a charector writing what well made written comedy with emotions is directly touches the heart
This line is very imp
Success pe peeche mat bhago kabil bano success jhak marke peeche ayegi 🔥🔥"
Didn't like the name,14 May 2010,10.0,"I loved this movie, it was a very smart and enjoyable movie despite the length. I loved the characters specially Rancho, Pro Virus and Silencer. I am not a fan of music in movies but I loved the music in this movie. The only thing I didn't like about the movie was the name: 3 idiots is not appropriate, it should have been ""Looking for Rancho"" or ""Al-its-wel"". Another thing was It doesn't explain much about why Rancho ran away from his friends and his love, it never explains why he couldn't express his love. You can sort of figure it out at the end of the movie, but is not that clear. Well despite all this it shows Hollywood that a movie can be funny and smart at the same time, and a college movie doesn't have to be about stupid humor, booze, bombshells and boobies."
Now it's clear why this have such popularity,27 November 2015,10.0,"I rarely watch this kind of movies. I mean ""real movie theater movies"". I usually watch low budget indie type mystery/scifi/horror movies, but this time I was looking some comedy to watch. And found this. And I'm very glad I did!Let's start with that fact this is comedy after all. It does this job very well. BUT, there is just A LOT more than that! This is clever, this is very, very emotional. Tears wasn't so far away to come for me. Really. I think I have never been so touched when watching a movie. And I'm not even very emotional person. (I think watching this alone with headphones contribute this fact.)Something also fascinates me about Indian culture also. I think the language is awesome! I have watched also the ""Slumdog Millionaire"" movie and must say that these are only two movies from India, which I have seen and jeez! Very good movies coming from Bollywood.All actor AMAZED me! Not to mention Aamir Khan definitely the most! What a talent. Of course, excellent directing was also very important! Such a clever screenplay. And I have also used to watch movies less than 2 hours but these three hours went in a flash when watching this.It's wonderful how this was actually comedy, but was also so instructive and emotional at same time. Loved it. Great work Aamir Khan and Rajkumar Hirani!"
Fun!,25 November 2012,10.0,"I love Chetan Bhagat's novels. I work with many engineers who immigrated to the US from India. Bhagat's novels (especially ""2 States"") help me appreciate the land they came from, that schooled them, and is still attached to their souls.Both ""Five Point Someone"" and ""3 Idiots"" tell about students suffering through college and the transformation to adulthood. Both stories are engaging, cleverly constructed and funny as hell, but they show different things, at a different pace. Novels show internal transformation, while movies show the transformation of relationships. Neither story is biographical. Neither story depicts ""reality"". Both stories work as fiction and frivolous entertainment. Both are respectful of their characters.If you want great art, read Tolstoy. To learn How Things Work, read Darwin. If you like the Marx Brothers, and you want to laugh your ass off, watch ""3 Idiots"". This is not a movie to make you think (Of COURSE universities in developing countries are lethally competitive) but to bombard you with the unexpected. Which for this westerner included the jarring Bollywood ""let's stop the plot and dance"", though in this case it is ""let's use dance to fire-hose a different set of sight gags at the viewers"". One part of your laughing brain can rest while another takes over. This movie will definitely engage all your humor muscles, including engineer and college nostalgia humor muscles if you have them. If you enjoy ""funny machines"", there are plenty of those, too.Some parts were beyond me - Silencer's idiosyncratic Hindi becomes mere word-substitution jokes in subtitle, and I'm left to imagine how his non-standard pronunciation and mannerisms are 2/3 of the humor Still, even Silencer and Virus were treated with respect - all the characters were victims of a situation created by colonialism, poverty, desperation, and ambition displacing love. You can cry or you can laugh - choose your movies accordingly. If you want to cry about abused students, watch ""Dark Matter"" (2007). If you don't like fart jokes, don't watch this movie, or read Benjamin Franklin, either.India turns out a lot of films. I'm sure all the elements of this movie are borrowed from others, and if you've watched a thousand movies you won't see much new stuff here. Good artists plagiarize, great artists steal, and these artists robbed the entire film vault. They pasted their swag together pretty well, and in some surprising (to me) ways.IMHO, a 170 minute movie is too long, which is why I give it a 9. But if they edited it down to 90 minutes, and kept all the best humor, I might have died laughing. It was never plodding, though it slowed from manic to almost sane in places.I'm buying 4 copies for Christmas presents - I have some godchildren that need their humor centers stretched. This ought to do it."
