Title,Date,Rating,Content
Wow this American loves this movie,20 November 2011,9.0,"I asked my co-workers to recommend a Bollywood movie. I expected ""Dumb and Dumber"" by the title. It wasn't that at all. It is more of an inspirational comedy with some serious but good messages. A more accurate title would have been ""The Legend of Rancho"".Odd to me is that they speak in part English, part Hindi through the movie, kinda like some speak ""Spanglish"" here I suppose. I know none of the actors but the acting was good, and there was plenty of humor. The characters were believable. Most movie dancing I find a little silly but I even liked the dancing routines in the bathroom.I will be asking my co-workers for more recommendations after this one!"
Hat-Trick Heroes x 3...,2 October 2020,9.0,"Like Dead Poets Society but with Robin Williams as a student and some extra tonic and spice thrown in for good measure. Serious, sad and silly, often concurrently but overwhelmingly very, very funny and engaging, as engineering students at an Indian college end up teaching as much as they learn. Who could disagree with the distinction between education and learning while recognising the often sizable gulf that exists between the two after watching this. Who would dissuade those with aspiration and passion from pursuing their dreams and goals. Weighing in not too shy of three hours you'll be shocked how quickly the time flies as your attention is vacuumed up and your view of the world turned on its head, or inverted, depending what you've learned."
THE BEST OF BOLLYWOOD; please sing along....,15 June 2021,9.0,"When I was 13, I had my first movie-love;
There was nothing that compared to this movie;
Nobody could eva stop me watchn this cult;
It had me goin crazy, oh I was star-struck!Watched every weekend, didn't need no other work;
Made me laugh made me cry made me become what I am today;
Inspired me, motivated me to achieve success every day;I was choking in the crowd, it made me roar aloud;
I was nowhere in my career, it made me a flourisher;
I used to be havin a bad time, it took me to cloud nine;
I was in pieces, it fixed me;
It made me a it made me a believer, believer.I was in pieces, it fixed me.It gave me another chance, I grew up once again
Na na na.... Na na na.... Na na na.... Na na nana na...."
Wonderfully entertaining.,2 June 2011,9.0,"It's hard for me to review this film, as I have not seen a huge number of Indian films--probably no more than a couple dozen. Most of the ones I've seen were wonderfully entertaining but I am far from an expert on Bollywood. Because of this, I have a hard time knowing how good this film is relative to other films from this country. So, consider this when you read this review. This may be among the very best India has to offer or it just seems that way to me.Like so many Indian films, this is a very, very long film--with a run-time of almost three hours. When a movie is bad or just okay, this can seem like forever, but since ""3 Idiots"" is a very, very good film I loved its length. And, like most films of the genre, it has its share of the usual singing and dancing so foreign to films from other countries. One thing you should know, however, is that defining the type of film it is isn't really easy. Much of it is a comedy, but it also has many poignant moments (keep the Kleenex nearby), some existential moments where they explore the meaning of life and work and it's also a tender film about friendship. And, as my daughter pointed out when she saw the film, she loved that the men in the movie are not afraid to cry--something you rarely see in western films.As for the plot, it's very long and involved and I could recount what occurs. But I don't want to spoil a single wonderful moment, so my advice is just sit back and watch--and if you give it a chance, I can almost guarantee you'll have a great time with this poignant and funny film. Wonderful and well worth your time--with a delightful script, wonderful characters and lots of moments that made me smile...and a few that brought me to tears. See this film."
Finally a masterpiece from Bollywood. Aamir Khan is the best thing to happen to Bollywood.,9 September 2013,9.0,"Awesome film man. Saw this with my family in a theatre. Worth every penny n worth every minute. Never seen such an amazing film from Bollywood.
What is so great about the movie is that it moves you, it gives you hope. It is a simple film, yet it has an everlasting message. The last 30 mins were beautifully shot. Very good direction by Hirani. The star cast is good n Aamir khan steals the show.
The editing is top notch. U don't feel bore for even a sec. Awesome screenplay. It's hands down the best film in the history of Bollywood."
Missed this gem for 12 years - Thanks to my wife,2 May 2021,9.0,"Thought provoking movie, it shows how Indian Parents force their children's. In every aspects (what to study, what to wear, where to work, so & so.Really if i had seen this movie before 12 years, my life would have been different.Must seeeee!!!!!!"
easily the best Indian movie in 2009.... and one of the best ever,24 December 2009,10.0,"I was lucky to see the first day show of 3 idiots on Thursday in Dubai. Well the title of this post says it all. The movie is an example of classic film making. brilliant and highly entertaining.Watch 3 idiots for a) amir khan's incredible acting b) intelligent and highly energatic screenplay & direction (Rajkumar Hirani has done it yet again!) c) amazing chemistry among actors, d) some of the best comedy scenes coming from Indian cinema in a long time and e) a heart warming story which keeps you spell binded right till the end.I would rate it as among the best from amir khan (which obviously means among the very best from bollywood. I would also give a lot of credit to the director rajkumar hirani, who after this movie (and his previous munna bhai series) should rank as among the top in bollywood too. 9/10."
One of the better Bollywood movies I saw,6 February 2016,10.0,"Because the movie had such a high rating on IMDb I was intrigued. Bollywood movies are not particularly on the top of my list I must admit. But I gave it a shot and I'm glad I did. It only has two scenes where they start singing and dancing so that was not too much. Why they start singing and dancing that I will never get. The story does not need that at all. The story itself was very pleasant to follow. Full of mixed emotions, happy ones and sad ones. The cast and the filming was great. All actors gave a good performance throughout the whole movie. Like in most American television series they want to give you a lesson in life and most of the time it makes me want to barf but in this Bollywood movie it works perfectly well. I had fun watching this and I get why I am not the only one. Certainly worth a watch."
"Good, but they overdid it.",28 December 2009,10.0,"I was eager to watch this movie as the only bollywood films i like are those of aamir khan. When i saw the trailer of the movie, i thought that this movie could be the best of all time in bollywood, but it considerably failed to be. The plot was somewhat interesting , the cast was very appropriate, the acting was superb, the dialogues were wonderful , but the director maybe oozing with overconfidence, tried to put just too much in it. He tried to put it in ALL the good and bad things a teenager should do while he is in college. It was hard to identify the real protagonist in this movie, and even in the end i was left wondering whether raju was the man in the spotlight or aamir. What i hate to watch and hear is a meaningless song with meaningless lyrics and meaningless dance. And thats just what was very prominent in the movie. I don't understand the purpose of such futile non-sense, is it because people like it ? OH REALLY??? or is it because the director finds it attractive? attractive like - cow dung over cake.!? Another flaw i noticed was the change in character of aamir - from when he was a small kid to his teenage years. He looked and behaved like the most innocent one and out-of-all-activities one and later he became the most notorious and daring guy in college. Let the movie be pathetic or super-hit , boman irani was as always at his peak. His character was very well presented and he did just fine enough to make him the funniest as well as the most brutal character in the movie. The movie also had a lot of dramatic, sensitive scenes, at the wrong times, which did at times bring tears in my eyes, and left the other brain-left-at-home audience sob while staring at the screen. I wont say anything about Kareena because there isn't any need to publicize her flaws, there's a need to look for the minimal positivity in her enacting of her cameo. Rest was very appeasing , it was a pleasure to watch nonetheless, and the film was worth watching. 7/10"
"3 hours of stereotypes, melodrama and rehashed jokes from the nineties",29 December 2009,10.0,"I got to see this movie at a special screening before it hit the theaters. The high expectation was palpable. After all, Aamir Khan has been producing successive hits over the years. Now for the movie - which starts in an engineering college in India, goes on to show the lives of three of its students through the years till they graduate. This being a Bollywood film, obviously has a smattering of romance and song and dance sequences. Right from the start where Aamir jaywalks into the college building without a care in the world to the time he starts questioning the teaching methods in class, its just a matter of a couple of days. Some cheeky guy this is! Unfortunately, all his antics and funny lines are as old as the college building he is in. You would have heard these jokes a hundred times over. Anyways, that is the best part of the film since it at least elicits a few laughs. The rest of the 3 hours is filled with stereotypes and melodramatic scenes which are ridiculous at best. It seems that these days in India, anyone who can make the audience cry can laugh all the way to the bank. Aamir has this knowledge and isn't afraid to use it."
more than just a laugh...taught me great life lessons as well,1 March 2011,10.0,"I'm from the Philippines. For years, I have always been curious about Indian cinema. I've seen clips of Indian films on cable TV and to be honest...I just don't get it. I don't get all the silly dancing and singing in almost all movies. I find it so corny and irrelevant to the story. But don't get me wrong, Philippine movies back in the 80's were also filled with corny singing and dancing. But we have gone past those and transitioned into movie-making based on good scripts...rather than cheesy story lines. When a friend of mine recommended this movie, I haven't really heard of it. I thought it was a Hollywood release but it wasn't. It was a Bollywood movie. He said it was really funny, so out of curiosity, I got hold of a copy. My first thought was that it was nothing but a silly story of 3 guys doing slapstick comedy that I have all seen before. When they started singing ""All iz well.."" I told myself... I knew it! Just what I thought.But as the movie progressed...I was amazed at the intelligence embedded in this movie. I was so impressed with the smart dialogues delivered by Amir Khan. It was so mature and thought-provoking. The life crisis all of them were in... the pressures at school..the pressures from society and the pressures from family as well... they rang so true. I was even at one time crying my heart out. I can't believe it! All the preconceived notions about a Bollywood movie were obliterated. I was so moved by this picture and I have no regrets seeing it."
Best moive,14 April 2021,10.0,Best of all. The way of narrating the story touches the soul in the heart because the college life which we go through it have shown so many rules when it will start imagining in your own real life that is really true in every life we have certain role and we have to go through it.
"This Christmas & New Year, go gift yourselves - watch this phenomena (Not for Professors) !",25 December 2009,10.0,"I'm an IITian myself and hence, needless to say, was looking forward to this movie as it is based on the life in IITs. I went with my family and watched the first-day-first-show and was I pleased ? In one sentence - The best Bollywood movie ever ! If you are into movies, then this one is not to be missed unless you are the 4th idiot. I cried, I laughed and I enjoyed every moment of the 3 hours that I spent watching this gem. The songs that seemed mediocre before watching the movie, feel like perfect for the movie. They are so ideal for the situations that I just loved them.As you can understand, they could not bring the name of any IIT into the movie to avoid disputes. But trust me, whatever they have shown about the life in IITs, it's all true. Right from suicides, cold-hearted Professors to lack of encouragement and support for talents who can really bring serious change in this world. The movie successfully depicts how once inside, your life is only about meaningless grades, go get into the race before it's too late.Take my free advice and avoid any reviews or words from people who have already seen the movie. Don't let anyone spoil any scene from the movie. Rush to the nearest theater and experience the phenomenon for yourself. You'll bless me for this advice !"
Aamir has yet again chased excellence & success follows him !,24 December 2009,10.0,"Plot Two idiots Farhan (Madhavan) and Raju (Sharman) sets outs on a journey to find their lost friend and the 3rd idiot Rancho (Aamir).. As the journey starts off, their college life and old memories of their friendship, with a unique free-thinker Rancho who inspired them and changed their lives, are unfolded through flashbacks and followed with some twists and turns...My Views 3 Idiots looks at our educational system which pressurizes the students and does not allow to chose his destination by his own wish, in a satirical way and brings out some of the flaws in it... On parallel there is a love angle between Rancho and Pia (Kareena)... Many of the situations/characters have resemblance or inspiration to ""Five Point Someone"", blockbuster novel penned by Chetan Bhagat...Both humour and emotional quotients are amalgamated in the right proportion, full credits to Raju for that... Film offers lots of quality rib-tickling moments throughout.. The intermission point offers a twist that is totally out of the blue and keeps you hooked to the movie ! Just when you think this feel-good comic caper is leading to its culmination, there is another surprising element at the climax which is brilliantly weaved out by Hirani...Technically, it rocks with astounding and visually arresting cinematography, the aerial shots of Shimla and Ladakh are a pleasant treat for our eyes... Editing was good... Song visualizations were cool... Music was good and well placed with the flow of the narration...Coming to performances, all of them comes out with convincing portrayals, but it is Aamir Khan, the real showman of Bollywood, steals the shows with yet another stellar portrayal and will go down as one of his best performances. His looks and mannerisms as a college student was genuine and consummate.. Madhavan and Sharman adds up with commendable performances... Kareena does her part well... Among the supporting, Boman Irani as the eccentric head of the institution was too good...On the downside, there are some unbelievable filmy situations which can be excused as writer's liberty and the episode of Mona's delivery was a bit far stretched.. Still these minor negatives does not affect this wholesome entertainer ! In short the basic theme of the movie is that ""chase excellence and success will follow"".. Just like that Aamir and Raju has chased excellence and success is following them...So to sum up, Aamir and Hirani has delivered the best movie of 2009... Do yourself a favour by seeing this highly emotional and feel good comic entertainer...Verdict : THE BEST of 2009 ! Rating : 9/10for more reviews of the latest Indian movies, visit www.snehasallapam.com"
This inspires me to watch more Bollywood movies,20 September 2017,10.0,"Until recently my only exposure to Indian cinema was Satyajit Ray. Like a lot of Americans, my knowledge of Bollywood was based entirely on film clips and American take-offs of lavish musical numbers.I searched a few lists of top Bollywood films and settled on 3 Idiots, which turned out to be a wonderful decision. The movie is terrifically funny and engaging, seamlessly moving from comedy to tragedy to musical numbers.The story centers around a brilliant, iconoclastic technical student who spends the movie telling people to follow their dreams. While generally lighthearted, the movie strongly addresses the apparently terrible stresses on Indian college students. But in spite of some dark moments, overall this is about as feel-good as you can get. Feel-good to an absurd degree? Sure. But what's so bad about feeling good?When I think of Bollywood I think of big musical numbers, and there are a handful here, although they're a tiny part of the three-hour running time. Still, they are tremendous fun.To sum up, I saw a Bollywood movie, I laughed, I cried, and now I want to see more.UPDATE: I saw more. So many good movies out there!"
Great Entertainer / but Story and Character holes,17 February 2010,10.0,"3 Idiots is way too short a movie, which is simply another way of saying that it is an extremely entertaining movie! Raju Hirani has served an hat trick. Three great movies in a row. Raju has brought his Gandhigiri to the world of education, this time the Gandhian is Rancho.Acting is great by Boman Irani, Sharman Joshi and the best Omi Vaidya or Chatur, without whom 3 idiots would not have been what it is.Its almost impossible to find any significant deviations to excellence when you have a team like this one. Raju, Boman, Aamir, the perfectionist to name a few.But there were a couple of things under the surface that disturbed me a little bit.To start with the easy one, When you anger your senior in the first 5 minutes of entering the college, you know for sure it cannot end there. So from that point of view, the ragging scene mysteriously ends prematurely. Another one is, Boman Iirani or Virus knows Rancho's dad's monthly income but not his address? They spend 10 years searching for him, why didn't they check the college register?Now for some serious ones.I like Aamir Khan movies because you never ever ever see Aamir, you only see the character he is playing, which is exactly how it should be. Unlike Salman Khan and Shah Rukh Khan movies where you see the movie stars instead of their characters (exceptions apply of course, for example in ""Chak de India"" you couldn't find Shah Rukh even if you wanted to). In 3 idiots, I got to see Aamir Khan more than a couple of times and I was surprised. That got me thinking, why would our perfectionist entertainer allow for something like this.The plot thickens and the mystery deepens. Hmmmm. So I dug deeper and eventually hit the gold mine. Its not Aamir, it's his character Rancho which has a fundamental flaw that even Aamir could not overcome. Rancho is projected as someone who loves to learn, he wants to take in every ounce of knowledge he can absorb for any source possible. But his actions are that of a revolutionary, from teaching the director on how to teach to mocking the definitions of machines and books. On one side he is a sponge, an introvert on the other hand he is a rebel, and extrovert. These opposites needed reconciliation in the story.Somewhere along the way, even meanness crept in. I am referring to Chatur's switched speech. Now don't get me wrong, I enjoyed every bit of that scene. But that does not mean that it flowed with Rancho's character. I think the writers mixed up Aamir's earlier characters, Aakash from Dil Chahta Hai would do this in a heartbeat, DJ from ""Rang de Basanti"" would probably go one step beyond, but not Rancho and definitely not for a ""demo"". Rancho is pure, or at least that's what Raju is portraying him. The same goes with the climax. Now, even though, all of us cheered when Chatur got shafted towards the end in a strange twist of fate. Some how I had a hard time believing that filing 400 patents and signing with the Japanese gel well with this Gandhian educator.Aamir, in his interview, mentioned his approach to looking young in the movie. His pacings, mannerisms, style of dialogue delivery etc. He executes brilliantly on them.Madhavan is decent. He could have been much better.Omi Vaidya, or Chatur, is the real find of this movie. Hope to see more from him.One additional aspect which is not easily apparent is that this is one of the few movies that projects intelligence with the coolness it deserves, and not in the traditional Hollywood style of nerd portrayal. This is a better role model for students. Towards that end it is on par with Matrix.To make it clear, this movie is vastly more entertaining than most of the movies of 2009. But I am not comparing this movie with other movies, that would be like comparing apples with windows. I am comparing this to other Aamir and Raju Herani movies. And in that comparison, this does not shine as bright.______________________Now, here's what I would have changed if I was in control.* Raggers are caught by the director and are convinced without any ""pressure"" not to rag any more * Reconcile Rancho's character's fundamental flaw, requires serious deep dive * Motivation for Chatur's speech prank redone, maybe not even instigated by Rancho * Some better reason why nobody can find Rancho * Redo the Javed Jaffery scene where he talks to his dead father, turning the tables to show that Javed actually wanted to take his father to Disney Land but his father kept on insisting that they wait for the highway contract to go thru. That would be hilarious. * Sharman Joshi's family is so central to him but are missing 10 years later, in the starting scene, some how bring them in. Maybe his wife is on the phone talking to his sister, happily married in Bombay, when she yells ""No Pants"".This review was originally posted on my blog: http://roundhayreview.blogspot.com/2010/01/3-idiots.html"
3 idiots is a masterpiece and easily one of the greatest Bollywood movies of all time,24 December 2009,9.0,"I saw the paid premiere of 3 idiots today.On the whole, 3 idiots is a winner all the way everythingwise.3 idiots suits the term 'landmark cinema' and has all it takes to help Bollywood take a giant step into world cinema with pride.3 idiots is a sparkling example of qualitative cinema.3 idiots not only entertains, it also enlightens.3 idiots is forward-thinking, but also makes you recall your roots. It promises lots of laughs and also a heartwarming message.There are movies aplenty, but very few remain etched in your memory and possess recall value. 3 idiots is one of those films. Indisputably and undeniably, this Aamir-Madhavan-Sharman outing is worth the price of the ticket and more.The film will set new records and has the merits to emerge one of the biggest hits of all times. The weekend business should be historic, the Week 1 business should be unparalleled, the lifetime gross should be amongst the biggest of all times. In short, 3 idiots has 'Blockbuster' written all over it.The story of 3 idiots has been told differently and most importantly, the story offers so many twists-n-turns that you just can't guess what would unfold next.There's so much happening in every scene and the screenplay is so gripping that you don't feel the need to look at the auditorium ceiling or at your watch at brief intervals. You aren't restless. 3 idiots demonstrates how strong film-making can enhance and elevate an already solid concept.An Aamir Khan film is nothing short of an event. The supremely talented actor acts in one film a year and no two films are ever identical in terms of plot line.To sum up, 3 idiots is commercial Hindi cinema at its best. The film has 'Hit' written all over it. Let me put it this way: Cancel whatever you're doing today and go watch 3 idiots instead.Director Rajkumar Hirani strikes a fine balance between humor and emotions. The comic portions are executed with panache, the drama is attention-grabbing and the emotional quotient is strong enough to turn you moist-eyed. The marriage of humor and emotions as also technique and content is what drives 3 idiots to the winning post."
One of the best movie of decade,24 December 2009,10.0,"Aamir does it again. what a movie .from start to the end, hilarious moments.screenplay is fantastic. full on comedy and yet it never looses its heart. Aamir pulls off a 22 year old character with brilliance. never for once you feel you are watching aamir .It was rancho on screen. sharman n madhavan - i bow down to them. music looks OK on cd but during movie it worked as a plus point. situational tracks works in the favour of film. runtime may sound a bit too much but believe me, you wont know when the first half is over. second half may seem a bit too hilarious but apart from that its a masterpiece. gr8 aamir ,another brilliant movie.10/10"
