Title,Date,Rating,Content
1 Idiot,20 October 2015,8.0,"I feel like a fool wasting three hours on what practically is the Indian equivalent of the Three Stooges. With some context, this was the first Bollywood film I had seen, and it doesn't make me want to rush back and view more. The jokes are pretty unfunny, almost inline with unintelligent slapstick comedy and weird foreign comedy. Nothing in this film made me want to continue viewing; poor acting, a poor script and horrible cinematography are among the worst I've ever seen.3 Idiots may be a favorite in it's homeland, but as a foreign viewer to India, I had a huge problem with viewing it. The jokes fall flat, very flat and the story feels juvenile and childish. 3 Idiots is among the worst in IMDb's top 250 and I discourage viewing at all costs."
Bollywood comedy blockbuster: pee jokes and wholesome life values,30 January 2010,7.0,"Released around Christmas 2009 in over half a dozen countries '3 Idiots' , reportedly the highest grossing Bollywood movie of all time, earned $70 million worldwide within 18 days of entering theaters. It was also officially released early to YouTube, another first. In the US, where it's being being shown at AMC/Regal theaters, it made $5.5 million in its first 17 days, the highest US take for a Bollywood import.So what is this paragon? No 'Slumdog,' it's much more a standard commercial Indian film product. That means it's long, it's got tears, laughter, excitement, music and dance, and homilies about work and family. It's got romance, a beautiful girl who finds the hero in the end, and it's got running pee and fart and bum jokes. The screenplay of '3 Idiots' is drawn from Chetan Bhagat's 2004 bestseller Five Point Someone, a novel initially published in English and later reissued in Hindi. Bhagat's novel deals with the college exam angst and romance issues of three student buddies. But the film goes further afield, including childbirth during a blackout due to a monsoon flood, travels through gorgeous mountain landscapes of Ladakh seen from the air, trips back and forth over the period of a decade, one marvelous scene when a professor's mass of equations and symbols float off the blackboard up into the lecture hall, caressing the students. There are several full-dress Bollywood song-and-dance numbers, one in a hospital. The bright-colored cinematography is pleasant to look at. '3 Idiots' is virtually an epic of shared coming-of-age experiences with wholesome messages. These are: be true to yourself, live your dream. Be positive: the hero's mantra is ""Aal izz well."" Don't cheat -- unless you have to in a good cause. Don't rely on memorizing stuff; think for yourself. Avoid obsessing about the price and value of things. Remember where you came from. Remember your friends. The pressures of school in India where it may be the only way out of poverty are made clear, including the high incidence of suicide among students.And learn Hindi. There's a sequence when a nerdy materialist who lived abroad and didn't study it much is chosen to give a public address in a high-falutin literary form of the language, ending up with some lines in Sanscrit, which he's even more ignorant of. The buddies inject naughty substitute homonyms like the equivalent of ""screw"" for ""serve"" and he becomes a laughing stock.It's this materialistic memorizer bloke, Chatur Ramalingam (Omi Vaidya), who starts off the pre-title sequence by calling Farhan Qureshi (R. Madhavan) to say he's located their engineering school pal ""Rancho"" (Aamir Khan) who disappeared after graduation. Farhan has to take the annoying and materialistic Chatur along as he rounds up best buddy Raju Rastogi (Sharman Joshi) to drive from New Delhi up to the mountain town of Shimla to find Rahcho, the pal who influenced and inspired them so much. Much of the film consists of flashbacks along the trip of all the many incidents that happened in engineering school, many involving the annoying and sadistic school principal Viru Sahastrabuddhe (Boman Irani), AKA ""Virus,"" who has a beautiful daughter, Pia (Kareena Kapoor).The mercurial and diminutive Khan is so talented he gets away with playing Rancho as a student even though he's forty-something. Rancho is a compelling character: he's the inspiration, the catalyst a young person needs to move beyond his origins and live his dreams. Farhan is from a middle class family and has a huge talent for nature photography; his dad has pushed him toward engineering but he hates it. Raju comes from a dirt poor family -- images of his sick father, unmarried sister, and failing mom are in old-movie black and white -- and the way the family's future is resting on his engineering degree so terrifies him that he continually panics and fails the school tests. But he's a tremendously decent, soulful fellow whose rigorous honesty ultimately wins over potential employers. Rancho, whose origins are as obscure as his brilliance is evident, bows to no one and gets away with all kinds of infringements of the rules because or his inventive mind and fundamental decency.This summary barely scratches the surface. '3 Idiots' moves with precipitous speed through a dizzying array of incidents. A puzzling surprise comes just before the mid-way ""Interval."" And I said it was long. With that ""Interval,"" the movie keeps you in the theater for three full hours. That's a lot of Hindi, and only a little English. But this feels like a cleansing, warm bath after Judd Apatow and Eddie Murphy. This is good entertainment, and it's neither mindless nor nasty. But is it art? Is it groundbreaking? No, one couldn't say that. It's just a breath of good humor and good sense from a more innocent place."
Over-hyped Movie. Good fun for half the way,29 December 2009,7.0,"I watched this movie yesterday with my family. To begin with, I quite liked the concept about engineering college and the pressures. There were a lot of funny scenes which had the audience in splits. The comic timing of all the actors Amir, Sharman Madhavan and Boman Irani was really good. Chatur is just remarkable, what a launch for him. And when I came out at the interval i was pretty happy. I thought the film would continue in the same way in the second half.But the second half was too filmy. I mean what was Javed Jaffry s character doing in the film? His character was most confusing and unbelievable. I felt that the romantic angle was totally unnecessary and a bit forced as if just introduced to put some masala in the flick. Had the writers stuck to the basic plot about fun in college and avoided romantic side-angles, it would have been more crisp and slick.I thought the film would focus also on all the fun in other years, college fests labs etc. But they missed out on all that. And, the pregnancy scene could have been avoided. That was too ""filmy"". But otherwise, good story with a nice social message about the lopsided educational system in India. Hope some teachers and people involved in the education industry watch this movie and try to do something to correct our outdated, one-sided education system.There is another thing that stands out in this movie- the cinematography. whether its the college ambiance at IIM Bangalore or Shimla or Ladakh etc. has been nicely captured. Music is also good and keeps you entertained.That said and done, this movie is just an entertainer.Just leave your brains at home while watching this, especially the in the second half."
Amazing & Inspiring! One of the Best!,1 October 2014,1.0,"In my opinion, ""3 Idiots"" is one of the best films that I have ever watched. The directing was unique. The acting was outstanding and very natural. The cinematography was very clean and smooth. The story was amazing and inspiring. The musical parts are fantastic. For me, it is a perfect film. I liked every thing about it. The TRT was approximately 3 hours, yet every seconds and minutes of it was perfection. At first I thought it was just like the same ""common"" type of comedy film. But I was wrong, it was different. It was unique in many ways. The mixture, chemistry and transitions of comedy and drama of this film was done perfectly. This is the kind of film that all people should watch. This is the kind of film that will teach you a lot of moral lessons in life. This film will help enlighten people and I promise to all that this film will change your life."
ALL TIME FAVE COMEDY DRAMA MOVIE.,31 March 2019,1.0,"A heartfelt movie that gives many social lessons. Watching this movie from start to finish feels like experiencing an entire journey along with these characters all the way. It makes u have a good and fun time as well making u think. I watched it 100 times already and u will still like it. Funny, inspiring, emotional, teaches many lessons, tells how to live!!! BRAVO!! 🏅"
Very joyful movie !,4 December 2012,10.0,"I watched it finally on DVD.The film is very good in every sense It's players , dances , winding key was too perfect You can laugh and cry in this film the film is entertaining ,feeling and meaningful There is perfect an Indian dance such as in every Indian film.Story Two friends Raju Rastogi(Sharman Joshi) and Farhan Qureshi(R.Madhavan) embark on a quest for a lost buddy Rancho(Aamir Khan). On this journey, they encounter a long forgotten bet, a wedding they must crash, and a funeral that goes impossibly out of control.I loved every moment of this movie. and I hope to watch a lot of future Indian movies like this.The movie is highly recommended to 'students' specifically."
Beautiful,7 September 2015,10.0,"I usually don't like movies from India. Specially because of cultural differences between west and east. However, this movie was different. The first half of movie had, indeed, a lot of Indian movie characteristics that made me feel the difference between hollywoodian movies and the bollywoodian - I suppose there is where this movie came from - ones. Besides the funny parts - expected from a self described comedian movie - the movie was disappointing me... until it started the second part. This final part added the drama needed for a perfect movie: it showed us real human problems. Even more: it showed how to solve it. All in a funny way. The main problem of the movie was: should we follow our heart to do what we like in our professional choice or just do what our parents ""suggests""? Other secundary problems - but not less important - were showed as well and all the adventure to solve it made the movie simply beautiful. Highly recommended."
Old wine in a new bottle kinda movie..disappointing and below average.,17 January 2010,8.0,"I just managed to catch this movie on TV today and I must say that I have never seen a more disappointing and old wine in a new bottle kinda movie. Lets face it, its a complete blend of Dil Chahta Hai, Rang De Basanti, Munnabhai MBBS..and other lesser known college dramas. The message is way too out-and-out..it could've been subtle, lined with situations carefully and intelligently weaved into the plot. 40 plus actors playing college kids is blasphemous! Stereotypical character development, average acting, old timer jokes..it just doesn't fit. The movie couldn't raise my interest even a bit. And I'd make a special mention of the wedding scene, reminded me of Aamir's Dil Hai Ke Manta Nahi. Its just one of those typical Bollywood mix 'n' match flicks with absolutely no soul. I really don't understand the hype and hoopla about it. Below average."
My favorite movie of all time,20 September 2015,8.0,"This is the kind of movie that you can watch over and over again, yet feel like you've never watched it before. The use of comedic flavor and serious drama complement each other perfectly to develop the central theme of the movie (which applies to a lot of people studying in countries where rote memorization is the primary approach used to study). Omi Vaidya is the actor that I felt really stood out in this movie. Aamir Khan and the rest of the core actors did a wonderful job in their roles, but Vaidya presented the perfect impressions of someone who has been corrupted by the flawed educational systems of these Asian countries.As for the rest of the components, they were absolutely outstanding. Hats off to Hirani and Chopra for meticulously developing a very realistic script and conveying a strong, profound message at the end. I felt that the inclusion of some of the songs was unnecessary, but that's just my opinion. This movie does span almost 3 hours, but the 3 hours will pass by like water roaring down from a waterfall.Whenever you get a chance, watch this movie. Not only will you laugh and cry, but you will also be able to take back a very valuable life lesson.10+/10"
"Great Movie, 3 Hours Full of Emotions, Crying and Laughing",30 November 2013,8.0,"I have seen this movie last year. I had seen ""Like Stars on Earth"" before and I loved it too. As I know this one was similar, and as I really like Amir Khan's movies I decided to watch. I liked this one more than ""Like Stars on Earth"" I am a teacher and in this movie there are great messages for all teachers and especially for parents. Education is the most important thing to have a bright future. Not only for people, also for countries. ""3 Idiots"" show the importance of correct educational choices and how teachers and parents play a very important role. The movie gives that message in an entertaining way but also touch people's heart. Although the movie is about India and Indian educational system, so similar problems happen every corner of the world. After I watched this movie, I knew I would watch it again. I recommended this to my students and my friends. I was not able to watch this movie with my students but I watched it with some of my friends and whoever I watched with or I recommended, loved it."
Best 3 hours in many many years,25 August 2014,8.0,"Many movies I watch, I try to think of the positive in them so I can give a fair score. This movie, I feel happy scoring it a 10, because it is simply marvelous. I did not have to think of the good things in it, it is just Good.I recommend watching it non stop if you can allocate the three hours. Careful who you watch it with, you will cry many many times.I won't describe the movie for you, it touches on human character. You will love it no matter what.For the comedy part of it, you will simply laugh from happiness. How much better is that than laughing at artificially constructed jokes? Thank yous dearly whoever did this movie."
Must watch!,27 December 2009,8.0,"Just came home after watching 3 Idiots and I can't wait to go back to see the movie again. Absolutely fantastic movie which I believe is going to be one of the classics like Andaz Apna Apna was - an all time favorite movie you could watch any time and any number of times.Raju Hirani comes back with a masterpiece and it has perfection written all over it. Nice story, nice narration, superb acting and great direction. I was hoping the movie wasn't a remake of the book and was glad to see that the basic characters and storyline were picked up and everything else was original. The actors were very believable in their roles - not for once did they look any older than students barely out of their teens and blended really well into their characters. The movie keeps you so into itself and had so much to offer that when interval came, I started wondering what could they come up with for the second half but they came back with something even better!The story is of 3 guys - Aamir Khan as Rancho, Sherman Joshi as Raju and R. Madhavan as Farhan going through their 4 years in an engineering college and beyond. All throughout the movie they were their characters and not actors. The movies is beautifully presented and is a laugh riot and has some very emotional moments. It all fits together and you can totally relate to the characters whether or not you went through those 4 years of engineering college like I did. The storytelling is brilliant and it doesn't have second which I found boring or felt like forwarding.Music is nice - not great but it fits with the movie. The movie also has a message about the education system in India and is very true.10/10 :)"
"Excellent, deserves 9/10 for a Bollywood movie",24 December 2009,8.0,"Thoroughly enjoyed the movie, the college humor, the extremely well done dialogs, picturesque cinematography, nice and fluid flow storyline - in fact most of the movie.Only turnoffs were the over-Bollywoodisation out of the realm of the believable, overdoing gross scenes like repeated showing of male rumps/undies. Some director just don't know where to draw the line. Maybe a Farhan Akhtar was needed for a final editing touch :-)But the movie overall manages to fully entertain and keep you in splits or at times tears during the entire time. Would be a 9.999/10 without the turnoffs - exactly where it falls half a point below ""Dil Chahta Hain"", though personally it is funnier!Extremely well cast. Aamir manages to look younger than ""Rang De Basanti"" or any other recent movie - nice acting too from everyone! Even the LA based Omi Vaidya has done a great job in his first Bollywood movie, as a geeky irritant.Do not miss it for anything!!!"
Best Movie,26 December 2014,10.0,"The best movie I have ever seen in the history of Indian Cinema. best Comedy, Little bit romantic, Story line was very awesome. The best part is the actor of the film is Aamir Khan, who is best for it. The starting of the film till the end Really Amazing. If i still watch it, it'll make me laugh out loud. Aamir khan the only actor who made such great films in Bollywood. Lagaan, Faana, sarfarosh, Dhoom 3, 3 Idiots And not Pk. PK is also the greatest movie of all time The Sound track of 3 idiots is awesome. I would rate it 9.5/10 'cause it is such an amazing film that can't be describe in words :) Thank Yew for reading my review"
Another Good Venture from Hirani,28 December 2009,7.0,"Well, three idiots is adopted from ""5 point someone"" novel by Chetan Bhagat and has been shot in IIM B'lore campus. I must admit that Mr. Hirani has come up with another good venture after Munna Bhai and its sequel.3 idiots illustrates the experiences of college life of 3 engineering friends. Unlike usual college comedies, this movie presents a fresh perspective with a message. Pre-interval part is totally hilarious and I can bet the comedy would roll you all in your seats. Just like MunnaBhai(s), Mr. Hirani has sought to bring forward a message through this movie. Therefore, though some instances post interval might appear out of line (must say a bit un-realistic) but viewers would like the overall movie.Aamir, as one of the protagonist, has been phenomenal in this movie as a college going student. Sharman, Madhvan and Boman Irani have also made very good contributions in the movie. Kareena looks good but her role is limited. Direction is good and the movie is set in the backdrop of Delhi.Its certainly worth one time watch.Hope you all enjoy this movie.Regards, MaDdyMacD"
Draggy Movie,1 January 2010,7.0,"Thankfully I drank coffee during the movie but ran out of m&m chocolates and was desperate to pass the time quicklyTo me a movie is an escapism from reality. I want to be thrilled and entertained. But '3 idiots' was reminding me of the reality and stating the obvious philosophies. It was predictable. Everything was so nice and cheesy. Oh hug me I hug you bullshits repeated over and over again. I love nice people and nice things happening BUT THATS IN REALITY. In the movie I wanted something different......End of the day, I had a sense of accomplishment for sitting through the entire movie."
The best Indian movie I've ever watched!,25 February 2018,2.0,"The review title said it all. Yeah, it's the best Indian movie of all time. It's totally great. The actors are great. The music, the actings and everything is great. It totally shows the education system of our country, Myanmar. That's why i love it. The movie shows the University life is fun and not stressed. A great film to spend your free time. 
As for me, I don't even remember how many times I've watched this movie. If you are searching for a great Indian movie, watch this one. Spending time in this film is totally worth it."
Really good,6 January 2020,2.0,"I remember watching this after me, my brother and my dad went to a video rental store (When they still existed) and we were picking a movie and we ended up with this one. We didn't really check the name properly and when we came home we felt like ""3 idiots"".Turns out that this movie was really good and we had a great evening watching it."
"Story, Acting, Drama - This film has it all",15 July 2022,9.0,"I love that it captures some harsh truth's about the Indian education system but manages to tell it through a hilarious epic story of these three friends (and the love interest, of course).I watched this film in theatres many years ago and it has remained my favourite Bollywood film of all time - thirteen years later.It is funny, dramatic, and captivating - and I have watched this film more times than I can count. Considering the length of the film, that's saying something."
Good,20 May 2022,9.0,Best movie.its one of the greatest movie you will ever see in your life. 100% movie.please watch it.It's amazing things. One of The best 5 movie in movie.
Not all is well.,16 November 2020,10.0,"This film is a mess. It mixed past with present time to tell a story. They completely ignore the most important questions like why Rancho has not contacted his friends in all these years, also why was Pia going marry ""ass"" again if she was proved that he's not worth it. Basicly this film completely ignores what the characters learned in the past and makes them do same mistakes only for the finale of the film for them to make the right choices again. Also this film likes to show many serious issues of the real world but then the next second it puts a terrible joke, so I could not take this film seriously at all. It's such a mess. It had many great ideas, the storyline is great, but it's just such a mess, it tries to mixes multiple genres at the same time which does not help."
One of the best film.....,28 September 2021,10.0,"Most of them don't live up to their hype, 3 idiots however deserves to be on that list 100%. This film has everything from a diverse cast, to a realistic respectful romance, to accurate and emotional portrayal of suicide and burdens parents put on their children to a well written strong and funny female character and last but not least an amazingly written main character who is played fantastically well. I had not heard of this film but am so I glad i found it! I laughed, I cried, I was utterly confused and i will not be forgetting this film anytime soon. To anyone who has not seen this film GO AND WATCH IT! You won't regret it."
It's good in parts but Okay as a whole.,20 September 2014,10.0,"It's good in parts but Okay as a whole. Aamir Khan this time comes up as an engineering student and does it not so convincingly. He seemed to have been through college not once but many times over, as he started telling 'Say your heart All is Well and things will fall into place'.The movie is about giving freedom to kids and a message to parents, let them be what they want to be do not enforce things on them. This is conveyed in a light sense and in a comical way. Yet, at times it becomes preachy, like the confrontation of Rancho with Virus where Rancho says 'Yeh Marks mere ko samajh aaye hi nahi' and yet not at many other times. It is a parody of itself take the black and white scenes of Raju's family or the scene of Chatur Lingam where he says that after 5 years lets see who will be where. But the good moments are far and only between as a few drizzles in a tropic summer.The cinematography is good only in parts. Like aerial shots of Shimla road and Ladakh scenes otherwise it was just good. The art designing is commendable with the look of college, hostel and other things done well. The editing was not precise as I thought there are lot of things that could have been cut out like the pregnancy sequence in climax. The casting was not apt except Boman Irani as Principal, Chatur Lingam guy the others were clearly not apt. The 3 main protagonists and the heroine were clearly a misfit as none seemed to be students. Acting was average as nothing was so great and so original as if it was never seen. Chatur Lingam was the silver lightning in the otherwise dry acting. Also to mention is Boman Irani as principal.The writing was mediocre as their previous ones were well written and witty Munnabhai movies. And this was an adaptation of Five Point Someone having read that, I can say that the whole backdrop and the characters and only a few situations were picked but the point that was told was different from the book. That book is much worse than this movie. I am not detailing any instances as mostly, I found them silly and stupid.And in parts, hardly a couple, the originality came out. The speech by Chatur Lingam is the saving grace otherwise it was merely pathetic but such instances took it to at least average level.All is surely not well and it's strictly Average - 2/5."
Awesome movie,30 August 2021,10.0,Movie with best story and drama. All the actors performed very well.
Wonderful,25 November 2021,10.0,"The structure of the film is absolutely wonderful. It teaches a lot of things for youngsters. It teaches to handle things calmly, thing practically. Overall its 10/10 for me."
Love the Movie,21 July 2021,10.0,This one was the best movie I would like to say. I love it.
